### ISSUE TITLE
stale hardcoded SNAT entries in openvpn-iptables.service

### ISSUE THREAD

**Issue by prof7bit** [Nyr/openvpn-install#991]
````
cat /etc/systemd/system/openvpn-iptables.service 
[Unit]
Before=network.target
[Service]
Type=oneshot
ExecStart=/usr/sbin/iptables -t nat -A POSTROUTING -s 10.8.0.0/24 ! -d 10.8.0.0/24 -j SNAT --to 10.0.5.1
ExecStart=/usr/sbin/iptables -I INPUT -p tcp --dport 443 -j ACCEPT
ExecStart=/usr/sbin/iptables -I FORWARD -s 10.8.0.0/24 -j ACCEPT
ExecStart=/usr/sbin/iptables -I FORWARD -m state --state RELATED,ESTABLISHED -j ACCEPT
ExecStop=/usr/sbin/iptables -t nat -D POSTROUTING -s 10.8.0.0/24 ! -d 10.8.0.0/24 -j SNAT --to 10.0.5.1
ExecStop=/usr/sbin/iptables -D INPUT -p tcp --dport 443 -j ACCEPT
ExecStop=/usr/sbin/iptables -D FORWARD -s 10.8.0.0/24 -j ACCEPT
ExecStop=/usr/sbin/iptables -D FORWARD -m state --state RELATED,ESTABLISHED -j ACCEPT
ExecStart=/usr/sbin/ip6tables -t nat -A POSTROUTING -s fddd:1194:1194:1194::/64 ! -d fddd:1194:1194:1194::/64 -j SNAT --to 2001:9e8:6bc4:7300:40d1:baff:fe7a:eca8
ExecStart=/usr/sbin/ip6tables -I FORWARD -s fddd:1194:1194:1194::/64 -j ACCEPT
ExecStart=/usr/sbin/ip6tables -I FORWARD -m state --state RELATED,ESTABLISHED -j ACCEPT
ExecStop=/usr/sbin/ip6tables -t nat -D POSTROUTING -s fddd:1194:1194:1194::/64 ! -d fddd:1194:1194:1194::/64 -j SNAT --to 2001:9e8:6bc4:7300:40d1:baff:fe7a:eca8
ExecStop=/usr/sbin/ip6tables -D FORWARD -s fddd:1194:1194:1194::/64 -j ACCEPT
ExecStop=/usr/sbin/ip6tables -D FORWARD -m state --state RELATED,ESTABLISHED -j ACCEPT
RemainAfterExit=yes
[Install]
WantedBy=multi-user.target

````

the `2001:9e8:6bc4:7300` prefix was my valid v6 prefix yesterday when I installed openvpn, but this morning, after working for 2 hours my provider changed the prefix and all my ipv6 connectivity came to a sudden unexpected halt immediately, in the middle of a working vpn session.

All my hosts, including the openvpn machine, got their new prefix on their ethernet interfaces, when I ssh into the openvpn host I can `ping6` any other host and `ip a` on all ethernet interfaces on all hosts shows the correct updated inet6 addresses everywhere.

Here (being ssh'ed into openvpn server) I ping directly from openvpn server (`eca8`) to a target host (`5b30`) in my network and watch it with tcpdump on that target host. Both addresses have the correct prefix, ping works:
````
11:12:51.645003 IP6 2001:9e8:6bdd:7100:40d1:baff:fe7a:eca8 > 2001:9e8:6bdd:7100:cc16:c8ff:fe2e:5b30: ICMP6, echo request, id 51002, seq 1, length 64
11:12:51.645056 IP6 2001:9e8:6bdd:7100:cc16:c8ff:fe2e:5b30 > 2001:9e8:6bdd:7100:40d1:baff:fe7a:eca8: ICMP6, echo reply, id 51002, seq 1, length 64

````

Here I ping the same target host (`5b30`) from a vpn client, again watching it with tcpdump from the target host
````
11:13:07.020434 IP6 2001:9e8:6bc4:7300:40d1:baff:fe7a:eca8 > 2001:9e8:6bdd:7100:cc16:c8ff:fe2e:5b30: ICMP6, echo request, id 13, seq 1, length 64
11:13:07.020490 IP6 2001:9e8:6bdd:7100:cc16:c8ff:fe2e:5b30 > 2001:9e8:6bc4:7300:40d1:baff:fe7a:eca8: ICMP6, echo reply, id 13, seq 1, length 64
11:13:07.021104 IP6 fe80::7eff:4dff:fe9e:62a5 > 2001:9e8:6bdd:7100:cc16:c8ff:fe2e:5b30: ICMP6, redirect, 2001:9e8:6bc4:7300:40d1:baff:fe7a:eca8 to 2001:9e8:6bc4:7300:40d1:baff:fe7a:eca8, length 152
11:13:07.021519 IP6 fe80::7eff:4dff:fe9e:62a5 > ff02::1:ff7a:eca8: ICMP6, neighbor solicitation, who has 2001:9e8:6bc4:7300:40d1:baff:fe7a:eca8, length 32
11:13:08.052246 IP6 fe80::7eff:4dff:fe9e:62a5 > ff02::1:ff7a:eca8: ICMP6, neighbor solicitation, who has 2001:9e8:6bc4:7300:40d1:baff:fe7a:eca8, length 32
11:13:09.075950 IP6 fe80::7eff:4dff:fe9e:62a5 > ff02::1:ff7a:eca8: ICMP6, neighbor solicitation, who has 2001:9e8:6bc4:7300:40d1:baff:fe7a:eca8, length 32
11:13:10.100238 IP6 fritz.box > 2001:9e8:6bdd:7100:cc16:c8ff:fe2e:5b30: ICMP6, destination unreachable, unreachable address 2001:9e8:6bc4:7300:40d1:baff:fe7a:eca8, length 112
````

It appears the source address of the tunneled/NATed ping (`eca8`) still has the stale prefix from yesterday (`x:x:x:7300`) instead of the new prefix from today (`x:x:x:7100`).

After rebooting several times I searched the entire installation for hardcoded addresses and found it in the systemd unit file openvpn-iptables.service.

Has this been created by this installer? Is there an automated update mechanism that for some reason does not work on my host, or is this a genuine bug?

**Comment by prof7bit** [comment]
I replaced the line
````
#ExecStart=/usr/sbin/ip6tables -t nat -A POSTROUTING -s fddd:1194:1194:1194::/64 ! -d fddd:1194:1194:1194::/64 -j SNAT --to 2001:9e8:6bdd:7100:40d1:baff:fe7a:eca8
````
with
````
ExecStart=/usr/sbin/ip6tables -t nat -A POSTROUTING -s fddd:1194:1194:1194::/64 ! -d fddd:1194:1194:1194::/62 -j MASQUERADE
````

(and the -D lines also)

and it appears to work, now I can ping and connect internal and external ipv6 hosts again. Does this have any drawbacks? I do not notice any speed penalty. 

Maybe this should be made the default at least for IPv6, because while it is reasonable to assume that a private IPv4 server address can remain static easily, the same is more difficult (or impossible) with IPv6 addresses in the typical DSL consumer environment.

**Comment by Nyr** [comment]
Congratulations, you diagnosed the issue and found the right solution for your setup.

Using MASQUERADE is required to work with dynamically assigned IP addresses, but almost any virtual or dedicated server will have static addressing, and that is why the installer uses SNAT which a better approach for those cases. You can search for the differences between them in case you are interested, but this is not really a bug, the installer expects you to have static IP addressing.

**Comment by thalesmaoa** [comment]
I'm having a similar issue, but the way I see, MASQUERADE is a lazy solution.
Unfortunately, I can't fix SNAT rule.

Using default SNAT, output packet is translated to my public ip address. When I ping a device in the network, the echo reply don't return. The ip should be 10.8.0.*, and not the public one.
